{
  "$schema": "./schemas/routes.schema.json",
  "kind": "autoprompt-route-contract",
  "contractVersion": "2.0.0",
  "defaultRoute": null,
  "predicateLanguage": {
    "version": 1,
    "operators": [
      "all",
      "any",
      "eq",
      "in",
      "gte",
      "gt",
      "lte",
      "sum-lte"
    ],
    "missingPathBehavior": "predicate-false"
  },
  "classificationInputs": [
    "requestedEffect",
    "successCriteria",
    "dependency",
    "uncertainty",
    "reversibility",
    "mutableResources",
    "sideEffects",
    "externality",
    "confidentiality",
    "thirdPartyImpact",
    "targetAuthorization",
    "costAuthority",
    "riskAndIndependentCheckFloor",
    "checkAndBaseline",
    "capturedIncidentDomains",
    "deadlineBudget",
    "operatorMinimumRoute",
    "transportCapability",
    "candidateFreeze",
    "architectureImpact",
    "fitsLightPlan",
    "approachNeedsShortPlanning",
    "shortOrderUnclear"
  ],
  "routeFactsSchema": {
    "type": "object",
    "required": [
      "schemaVersion",
      "requestedEffect",
      "successCriteria",
      "dependency",
      "uncertainty",
      "reversibility",
      "mutableResources",
      "sideEffects",
      "externality",
      "confidentiality",
      "thirdPartyImpact",
      "targetAuthorization",
      "costAuthority",
      "riskAndIndependentCheckFloor",
      "checkAndBaseline",
      "capturedIncidentDomains",
      "deadlineBudget",
      "operatorMinimumRoute",
      "transportCapability",
      "candidateFreeze",
      "missingUserInput",
      "architectureImpact",
      "fitsLightPlan",
      "approachNeedsShortPlanning",
      "shortOrderUnclear"
    ],
    "properties": {
      "schemaVersion": {
        "const": "2.0.0"
      },
      "requestedEffect": {
        "enum": [
          "inspect",
          "report",
          "research",
          "decide",
          "mutate",
          "external-operation"
        ]
      },
      "successCriteria": {
        "enum": [
          "ready",
          "short-clarification",
          "unresolved"
        ]
      },
      "dependency": {
        "type": "object",
        "required": [
          "shape",
          "dependentWorkGroupCount",
          "integrationOwnerRequired",
          "separateDependentBodies"
        ],
        "properties": {
          "shape": {
            "enum": [
              "bounded",
              "independent-edits",
              "connected",
              "dependent-groups"
            ]
          },
          "dependentWorkGroupCount": {
            "type": "integer",
            "minimum": 0
          },
          "integrationOwnerRequired": {
            "type": "boolean"
          },
          "separateDependentBodies": {
            "type": "integer",
            "minimum": 0
          }
        },
        "additionalProperties": false
      },
      "uncertainty": {
        "enum": [
          "none",
          "reversible-technical",
          "architecture",
          "product-semantic"
        ]
      },
      "reversibility": {
        "enum": [
          "fully-reversible",
          "locally-reversible",
          "staged-rollback-required",
          "irreversible"
        ]
      },
      "mutableResources": {
        "type": "array",
        "items": {
          "type": "object",
          "required": [
            "kind",
            "identity",
            "shared",
            "ownershipMode"
          ],
          "properties": {
            "kind": {
              "enum": [
                "file",
                "directory",
                "service",
                "database",
                "output",
                "cache",
                "port",
                "external-system"
              ]
            },
            "identity": {
              "type": "string",
              "minLength": 1
            },
            "shared": {
              "type": "boolean"
            },
            "ownershipMode": {
              "enum": [
                "single-owner",
                "ordered-transfer",
                "isolated-copy",
                "exclusive-lease"
              ]
            }
          },
          "additionalProperties": false
        }
      },
      "sideEffects": {
        "type": "array",
        "uniqueItems": true,
        "items": {
          "enum": [
            "deliverable-write",
            "build-cache-write",
            "database-write",
            "service-state-change",
            "external-write",
            "message-or-notification",
            "permission-change",
            "money-or-quota",
            "destructive-change"
          ]
        }
      },
      "externality": {
        "enum": [
          "local-only",
          "external-read",
          "external-write"
        ]
      },
      "confidentiality": {
        "enum": [
          "public",
          "internal",
          "confidential",
          "restricted"
        ]
      },
      "thirdPartyImpact": {
        "enum": [
          "none",
          "incidental",
          "material"
        ]
      },
      "targetAuthorization": {
        "type": "object",
        "required": [
          "targetIdentities",
          "authorizedTargetIdentities",
          "authorizationEvidenceHash",
          "allTargetsAuthorized"
        ],
        "properties": {
          "targetIdentities": {
            "type": "array",
            "uniqueItems": true,
            "items": {
              "type": "string",
              "minLength": 1
            }
          },
          "authorizedTargetIdentities": {
            "type": "array",
            "uniqueItems": true,
            "items": {
              "type": "string",
              "minLength": 1
            }
          },
          "authorizationEvidenceHash": {
            "oneOf": [
              {
                "type": "null"
              },
              {
                "type": "string",
                "pattern": "^[a-f0-9]{64}$"
              }
            ]
          },
          "allTargetsAuthorized": {
            "type": "boolean"
          }
        },
        "additionalProperties": false
      },
      "costAuthority": {
        "type": "object",
        "required": [
          "mayIncurCost",
          "estimatedCostMicrounits",
          "limitMicrounits",
          "approvalRequired",
          "approvalGranted",
          "approvalEvidenceHash",
          "withinLimit"
        ],
        "properties": {
          "mayIncurCost": {
            "type": "boolean"
          },
          "estimatedCostMicrounits": {
            "type": "integer",
            "minimum": 0
          },
          "limitMicrounits": {
            "type": "integer",
            "minimum": 0
          },
          "approvalRequired": {
            "type": "boolean"
          },
          "approvalGranted": {
            "type": "boolean"
          },
          "approvalEvidenceHash": {
            "oneOf": [
              {
                "type": "null"
              },
              {
                "type": "string",
                "pattern": "^[a-f0-9]{64}$"
              }
            ]
          },
          "withinLimit": {
            "type": "boolean"
          }
        },
        "additionalProperties": false
      },
      "riskAndIndependentCheckFloor": {
        "type": "object",
        "required": [
          "level",
          "minimumCheckerCount",
          "namedDistinctResponsibilities"
        ],
        "properties": {
          "level": {
            "enum": [
              "ordinary",
              "elevated",
              "staged-high-impact"
            ]
          },
          "minimumCheckerCount": {
            "type": "integer",
            "minimum": 1,
            "maximum": 2
          },
          "namedDistinctResponsibilities": {
            "type": "array",
            "uniqueItems": true,
            "items": {
              "type": "string",
              "minLength": 1
            }
          }
        },
        "additionalProperties": false
      },
      "checkAndBaseline": {
        "type": "object",
        "required": [
          "checkQuality",
          "availableCheckKinds",
          "baselineStatus",
          "hiddenExternalCheck"
        ],
        "properties": {
          "checkQuality": {
            "enum": [
              "authoritative",
              "public",
              "observable",
              "short-plan",
              "coordinated-design",
              "unavailable"
            ]
          },
          "availableCheckKinds": {
            "type": "array",
            "uniqueItems": true,
            "items": {
              "type": "string",
              "minLength": 1
            }
          },
          "baselineStatus": {
            "enum": [
              "not-applicable",
              "recorded",
              "required-before-production",
              "unavailable"
            ]
          },
          "hiddenExternalCheck": {
            "type": "boolean"
          }
        },
        "additionalProperties": false
      },
      "capturedIncidentDomains": {
        "type": "array",
        "uniqueItems": true,
        "items": {
          "enum": [
            "MISSION_SOURCE_CONFLICT",
            "SIGNATURE_SEARCH",
            "FIXTURE_PROVENANCE",
            "HIDDEN_EXTERNAL_ORACLE",
            "IMAGE_DATUM",
            "DONE_RETRY_PROMOTION"
          ]
        }
      },
      "deadlineBudget": {
        "type": "object",
        "required": [
          "remainingSeconds",
          "admissionSeconds",
          "executionReserveSeconds",
          "verificationReserveSeconds",
          "recoveryAndFinalizationReserveSeconds"
        ],
        "properties": {
          "remainingSeconds": {
            "type": "number",
            "minimum": 0
          },
          "admissionSeconds": {
            "type": "number",
            "minimum": 0
          },